{
  "owner": "你的昵称",
  "name": "mypet",
  "breed": "棕白边牧",
  "gender": "公",
  "birthday": "2023-08-20",
  "gotchaDay": "2023-10-01",
  "ageStage": "成年",
  "devices": "Mac",
  "lengthCm": 60,
  "heightCm": 50,
  "legCm": 30,
  "widthCm": 22,
  "build": "标准",
  "notes": "咖白花色，右侧围脖没开完，嘴筒子有几个麻子",
  "photos": [
    "photos/正面照.jpg",
    "photos/侧面照.jpg"
  ],
  "ratio": "1.2:0.4:1",
  "legRatio": "0.6:1"
}